id,text,source_url,comment_id,created_at,collection_source,apify_dataset_id,apify_run_id
Y29tbWVudDoxNDY3MTg5NDQ4Nzc4NTc3XzE3MjA5OTk5NDkwNTIzNDY=,"Before handing out the budget to the public to see, they were like ""damn will the public believe this break down"" and then someone said ""let's defeat them with English"" 😂😂",https://web.facebook.com/share/p/1UfxVy7FRx/,Y29tbWVudDoxNDY3MTg5NDQ4Nzc4NTc3XzE3MjA5OTk5NDkwNTIzNDY=,2026-06-20T12:25:45.000Z,apify/facebook-comments-scraper,,
Y29tbWVudDoxNDY3MTg5NDQ4Nzc4NTc3XzEzMDk2NDEyNDgwMzgxOTA=,"Buses can't go empty i already packed my belongings kaya zipolopolo ndidzikazinda konko

Ndinamvanso kuti mowa umantchipa wil be drinking daily just to walk zigzag to avoid bullets and ndikagwa ndidzikhala ndikudzinda bullet",https://web.facebook.com/share/p/1UfxVy7FRx/,Y29tbWVudDoxNDY3MTg5NDQ4Nzc4NTc3XzEzMDk2NDEyNDgwMzgxOTA=,2026-06-20T12:15:38.000Z,apify/facebook-comments-scraper,,
Y29tbWVudDoxNDY3MTg5NDQ4Nzc4NTc3XzE3MTYzOTc2MDMxMTM0MDM=,K24 billion? Someone is definitely getting a new mansion out of this 'repatriation' budget.,https://web.facebook.com/share/p/1UfxVy7FRx/,Y29tbWVudDoxNDY3MTg5NDQ4Nzc4NTc3XzE3MTYzOTc2MDMxMTM0MDM=,2026-06-20T12:21:13.000Z,apify/facebook-comments-scraper,,
Y29tbWVudDoxNDY3MTg5NDQ4Nzc4NTc3Xzk5MTYyNjI3MDE2MDk1Ng==,3 and 4 is for the Pockets for big stomach guys,https://web.facebook.com/share/p/1UfxVy7FRx/,Y29tbWVudDoxNDY3MTg5NDQ4Nzc4NTc3Xzk5MTYyNjI3MDE2MDk1Ng==,2026-06-20T12:16:54.000Z,apify/facebook-comments-scraper,,
Y29tbWVudDoxNDY3MTg5NDQ4Nzc4NTc3XzEzNTM4MjExMzAwNDEwMDU=,"Family tracing, how? Anaiwala kwawo?",https://web.facebook.com/share/p/1UfxVy7FRx/,Y29tbWVudDoxNDY3MTg5NDQ4Nzc4NTc3XzEzNTM4MjExMzAwNDEwMDU=,2026-06-20T12:30:45.000Z,apify/facebook-comments-scraper,,
